title,publish_date,authors,url,keywords,summary,word_count,category
The most successful developers share more than they take,2020-05-14 00:00:00,"['Ben James', 'Medi Madelen Gwosdz', 'Ritika Puri', 'Ben Popper']",https://stackoverflow.blog/2020/05/14/the-most-successful-developers-share-more-than-they-take/?utm_source=Iterable&utm_medium=email&utm_campaign=the_overflow_newsletter,"['developers', 'source', 'questions', 'sharing', 'successful', 'podcast', 'share', 'blog', 'started', 'personal']","After interviewing several developers, a pattern started to become clear: great developers share a lot.
After interviewing several developers, a pattern started to become clear: great developers share a lot.
After reaching out to Joel Spolsky (who also happened to have a very successful blog, joelonsoftware), they started Stack Overflow.
To truly embrace public-by-default, it’s not enough to share your successful projects and knowledge, but additionally to bring the humility to share your learning and failures.
Sharing makes you strongerFor top software developers, sharing isn’t a byproduct of their success—it’s often the cause of it.",1451,
Ensuring backwards compatibility in distributed systems,2020-05-13 00:00:00,"['Michael Pratt', 'Ryland Goldstein', 'Tim Lehnen', 'Ben Popper', 'Jon Chan']",https://stackoverflow.blog/2020/05/13/ensuring-backwards-compatibility-in-distributed-systems/?utm_source=Iterable&utm_medium=email&utm_campaign=the_overflow_newsletter,"['systems', 'distributed', 'backwards', 'services', 'version', 'code', 'web', 'api', 'compatibility', 'apis', 'message', 'ensuring', 'data', 'way']","This can happen in a variety of ways: web APIs, messaging such as JMS or Kafka, and even in data stores.
Web APIsRESTful web APIs are one of the main ways in which distributed systems communicate.
Let’s look at some ways we can make our web APIs backwards compatible.
If you’re willing to put in the effort, achieving the three Ns is a great way to ensure backwards compatibility throughout a distributed system.
DistributedSince we’re dealing with distributed systems, it’s likely that a feature toggle will need to be accessed by multiple applications.",3160,
Port Fabri draft,,[],https://www.robinsloan.com/overworld/archive/port-fabri-draft/,"['fabri', 'innkeeper', 'cider', 'apple', 'draft', 'kai', 'green', 'ships', 'port', 'brandy', 'goat']","Port Fabri must have been grand indeed, for it merited an entry in Perils of the Overworld, which described it thusly:Small cider port.
Did he imagine he would stride through Port Fabri and step onto a ship, never looking back, hardly even to either side?
Distances a bit shorter there.”The distance between Port Fabri and the New Capital was shorter in hell?
All the other innkeepers of Port Fabri were there, as well as cider makers, apple traders, port administrators, and the head of the stevedore’s union.
Once, a boy did go to Port Fabri, and there he built a business.",2420,
AR Copy Paste tool allows users to drop images of objects into a computer,2020-05-16 00:00:00,['Eleanor Gibson'],https://www.dezeen.com/2020/05/16/ar-copy-paste-augmented-reality-tool-cyril-diagne/?utm_medium=email&utm_campaign=Dezeen%20Weekly%20673&utm_content=Dezeen%20Weekly%20673+CID_b7b8256e10266bb3210ab18b6d17a89c&utm_source=Dezeen%20Mail&utm_term=Read%20more,"['copy', 'tool', 'program', 'object', 'paste', 'images', 'computer', 'diagne', 'objects', 'allows', 'prototype', 'ar', 'number', 'users', 'drop', 'real']","Designer and programmer Cyril Diagne has created an augmented reality tool that can capture images of real-world objects and add them to a computer program in a few seconds.
AR Copy Paste allows users to take a photo of an object in the real world and drop the image into a desktop computer program with a few simple actions on their smartphone.
Users then move the smartphone over their computer screen to paste the object image into a compatible computer program, such as Photoshop or InDesign.
""AR Copy Paste originates from personal research in interaction design, exploring how machine learning can help make our interactions with digital systems more natural,"" Diagne explained.
AR Copy Paste is the latest in a series of tests created by Diagne, a Google artist-in-residence.",515,
The Cosmopolitan Of Las Vegas — Jesse Solomon Clark,,[],https://www.agentsdelfuturo.com/little-winter,"['deep', 'las', 'clark', 'jesse', 'cosmopolitan', 'yonder', 'vegas', 'life', 'digital', 'day', 'solomon', 'scenes', 'music', 'effects', 'project']","Five hand-built dioramas are brought to life in a large-scale film and music installation at The Cosmopolitan.
The project also spans several hundred other digital displays across the resort including elevators and outdoor marquee.
Filled with hidden stories, the frozen scenes are brought to life with animated figures and environmental effects.
An original music score accompanies each scene as a winter’s day passes from dawn to the deep of night.
Credit-> Client: The Cosmopolitan of Las Vegas | Concept, Design and Direction: YONDER | Scenic Fabrication: Nix & Gerber Studio | Animation and Effects: Ntropic, Simon Mowbray, Creative Director | Executive Producer for Yonder: Jennifer Senkler",173,
"Coronavirus Notebook: Finding Solace, and Connection, in Classic Books",2020-05-05 00:00:00,['Michiko Kakutani'],https://www.nytimes.com/2020/05/05/books/review/coronavirus-new-york-life-michiko-kakutani.html?referringSource=articleShare,"['road', 'world', 'notebook', 'finding', 'books', 'plans', 'homes', 'events', 'series', 'solace', 'days', 'disease', 'city', 'connection', 'coronavirus', 'social', 'classic']","It conjures our worst nightmares (Poe’s “The Masque of the Red Death,” Katherine Anne Porter’s “Pale Horse, Pale Rider”).
At the same time, books make us aware of the gifts bestowed by historical progress.
The only way people could “converse with any of their friends,” Defoe wrote, was to shout through an open window.
Unable to make plans (travel plans, business plans, wedding plans, even lunch plans), we are forced to live in a continuous present.
New York’s WFAN reran games from the Yankees’ 2009 World Series run, while ESPN is airing “The Last Dance,” a 10-part documentary about Michael Jordan and the Chicago Bulls’ road to their sixth N.B.A.",813,
POTO diary: paused,,[],https://www.robinsloan.com/overworld/week/7/,"['development', 'video', 'read', 'poto', 'paused', 'weeks', 'game', 'im', 'week', 'diary', 'project', 'edition']","Week 7, pausedThis is an edition of Robin Sloan’s video game development diary.
The diaryJordan Mechner’s The Making of Prince of Persia is his contemporaneous development diary for that video game, which is considered an all-time classic.
(This development diary of mine is a different animal entirely, because, even though it’s chronicling a process, it’s written with an audience in mind.
The game80 Days is a narrative adventure that was released in 2014 and remains, in my opinion, the best-written video game.
From Oakland,RobinThis has been an edition of my video game development diary, sent by email every few weeks.",1027,
,,[],"https://www.sscnet.ucla.edu/comm/kjohnson/Lab/Publications_files/Dunning,%20Johnson,%20et%20al.%20%28200%230",[],,0,
"The Quirky, Endearing Tradition of “Duck” Architecture",2019-01-10 17:39:27.818000+00:00,"['Alexxa Gotthardt', 'Jacqui Palumbo', 'Daria Harper', 'Artsy Editorial']",https://www.artsy.net/article/artsy-editorial-quirky-endearing-tradition-duck-architecture,"['architecture', 'endearing', 'tradition', 'duck', 'right', 'youll', 'worldwide', 'shaped', 'form', 'basket', 'longaberger', 'uncanniest', 'quirky', 'building', 'wasnt']","Dave Longaberger wasn’t an architect when he conceived one of America’s uncanniest structures—a seven-story office building shaped like a giant picnic basket—but nothing could deter him from erecting it.
“If they can put a man on the moon,” he contended, “they can certainly build a building that’s shaped like a basket.”As it turned out, Longaberger was right.
In 1997, the headquarters of his eponymous basket company opened its doors, its form mimicking Longaberger Co.’s best-selling Medium Market Basket, right down to its arched handles and shiny, imitation-brass tag.
The Longaberger Co. building is one of many structures worldwide that plainly reveal their function—or a product they hawk—via their design.
In Queensland, Australia, you’ll find a tropical fruit store in the form of a towering pineapple; in Meitan, China, a tea museum is housed within a 242-foot-tall teapot; and in Bailey, Colorado, a diner specializing in hot dogs takes the form of a mustard- and relish-slathered frankfurter.",172,
The faster frontend build tool,,[],https://www.snowpack.dev/,"['web', 'tool', 'try', 'webpack', 'workflow', 'faster', 'unnecessary', 'snowpacksnowpack', 'frontend', 'system', 'work', 'stay', 'build']","What is Snowpack?
Snowpack is a lightning-fast frontend build tool, designed for the modern web.
It is an alternative to heavier, more complex bundlers like webpack or Parcel in your development workflow.
Snowpack leverages JavaScript's native module system (known as ESM) to avoid unnecessary work and stay fast no matter how big your project grows.
Once you try it, it's impossible to go back to anything else.",70,
,,[],https://twitter.com/LEGO_Group/status/1256554151485595650?mc_cid=1a02487d7a&mc_eid=e7c75333ad,"['detected', 'browser', 'legacy', 'weve', 'disabled', 'proceed', 'javascript', 'twitteryes']",,19,
,,[],https://mcusercontent.com/2e2c86e49a5f6d1fd1ab7ce70/files/8d160088-2c9a-4dc0-9330-fe8a57a532ff/Battery_Teardown_Tests_Energizer_Brands_vs_Duracell_and_AmazonBasics.pdf?mc_cid=1a02487d7a&mc_eid=e7c75333ad,[],,0,
A Weekend of Anger and Defiance Across New York City,,"['Emily Witt', 'Emily Wit', 'David Remnic', 'Luke Mogelso']",https://www.newyorker.com/news/our-local-correspondents/a-weekend-of-anger-and-defiance-across-new-york-city-george-floyd-police-protesters,"['stood', 'weekend', 'york', 'small', 'sign', 'group', 'black', 'protesters', 'young', 'greene', 'city', 'street', 'anger', 'defiance', 'demonstrators']","How ’bout that?” a black woman in a camouflage jacket and glasses yelled, her hair tied up in a scarf.
I biked east to the Eighty-eighth Precinct, in Bed-Stuy, on a tip from an observer who saw my press pass.
The protesters, most of them standing on Classon, turned toward Greene, running up the sidewalk where I stood.
I tried to shrink against the metal pole of a street sign.
He was black, small, and slight, and wore his hair tied up in a poofy ponytail.",1244,
Olafur Eliasson turns elements from nature into augmented reality artworks,2020-05-14 00:00:00,['Natashah Hitti'],https://www.dezeen.com/2020/05/14/olafur-eliasson-augmented-reality-wunderkammer/,"['augmented', 'artworks', 'turns', 'works', 'wunderkammer', 'nature', 'eliasson', 'art', 'virtual', 'artist', 'olafur', 'reality', 'elements', 'rare', 'acute']","Danish-Icelandic artist Olafur Eliasson is bringing rare natural matter, including a burning sun and a sprightly puffin, into people's homes with his AR Wunderkammer works.
The Wunderkammer project, which is available through an app, marks the first time that Eliasson has employed augmented reality (AR).
Wunderkammer was made in collaboration with Acute Art – a virtual and augmented reality production studio that specialises in creating digital artworks.
""Can today's immersive technologies, virtual reality (VR) and augmented reality (AR), change and expand the ways we experience art?""
""Acute Art was founded on the vision of democratising art and bringing it to places where it could not be before.""",494,
‎Acute Art,,[],https://apps.apple.com/tt/app/acute-art/id1488435802,"['shadow', 'intensity', 'artworks', 'reality', 'art', 'artwork', 'place', 'light', 'night', 'augmented', 'torch', 'acute']","A new way to discover, experience and collect augmented reality artworks by the world's most celebrated artists.
Use the app to place the artwork, adjust the shadow angle and light intensity to match your surroundings or switch on the torch to light up the artwork at night.
Then capture it in a stunning photo or video and share with family and friends.
Features:- A collection of augmented reality artworks- Night mode: a torch which lights up the artwork- Adjustable shadow angle and light intensity- Place, view, photograph and film augmented reality artworks in the real world- A gallery of photographs and videos",103,
Hidden Architecture » Alpine Architecture,2015-11-15 19:18:00+00:00,['Article Written Hidden Architecture.'],http://hiddenarchitecture.net/alpine-architecture/,"['el', 'architecture', 'y', 'hidden', 'bruno', 'la', 'alpine', 'en', 'taut', 'una', 'que', 'su']","The First World War (1914-1918) had a strong effect on Bruno Taut and his later architecture because he became in a pacifist.
La primera guerra mundial (1914-1918) tuvo un importante efecto en Bruno Taut y su arquitectura posterior, convirtiéndole en un pacifista convencido.
Bruno Taut attempts to a futurist utopian, where technology has to help to the Geist.
Shortly after publishing this book, Bruno Taut showed his new work ‘Alpine Architektur’ where he designed his secular temples in a very creative sequence of drawings.
Glass and steel are seen in Alpine Architecture as elements that break away from the materialism of the period.",759,
It’s Time to Build for Good,2020-04-30 00:00:00,"['Isaac Wilks', 'Isaac Wilks Is An Undergraduate At Yale University', 'Studying Political Science', 'The Chinese Language. He Is Interested In Institution Building', 'Geopolitics', 'Urbanism. He Can Be Found On Twitter At']",https://palladiummag.com/2020/04/30/its-time-to-build-for-good/?mc_cid=4c97e5a59a&mc_eid=e7c75333ad,"['andreessen', 'political', 'politics', 'industry', 'american', 'good', 'vision', 'industrial', 'building', 'future', 'build']","It is undeniable that we are undergoing a crisis of will—and that nearly everything around us in America cuts against the impulse to build a future.
Once we finally set about trying to rebuild American industrial capacity, we may be in for a nasty surprise.
What if the only way to build the future is to lead with a positive vision of the good?
Not everyone wants to build a glass tower, but most people if given the chance like to build with their hands.
It’s time to build for good.",2690,
Guides for Visualizing Reality,2020-06-01 00:00:00,['Nathan Yau'],https://flowingdata.com/2020/06/01/guides-for-visualizing-reality/?utm_campaign=Data_Elixir&utm_source=Data_Elixir_288,"['step', 'visualizing', 'visualization', 'timevisualizing', 'thats', 'sense', 'visual', 'right', 'guides', 'realities', 'reality', 'data']","We like to complain about how data is messy, not in the right format, and how parts don’t make sense.
Here are several guides to help with visualizing these realities, which seem especially important these days.
Visualizing Incomplete and Missing Data We love complete and nicely formatted data.
Visualizing Outliers Step 1: Figure out why the outlier exists in the first place.
Visualizing Differences Focus on finding or displaying contrasting points, and some visual methods are more helpful than others.",112,
Visualizing the Uncertainty in Data,2018-01-08 00:00:00,['Nathan Yau'],https://flowingdata.com/2018/01/08/visualizing-the-uncertainty-in-data/,"['uncertainty', 'outcomes', 'represent', 'visualizing', 'range', 'represents', 'values', 'dont', 'possible', 'data', 'various']","A point in the middle represents a mean or median, and a bar or line shows other possible values or coverage.
ConsIf you have a full distribution of values, you don’t get to see all of the details in the data.
DistributionsShow the spread of possible values with a histogram or a variant of it.
Multiple OutcomesWhen it comes to projections and forecasts, it is helpful to see various outcomes to see what might happen.
ProsWhen data appears all at once or in aggregate, it can be a challenge for many to interpret results and link it back to what the data actually represents.",905,
Why I wrote my book with O'Reilly,,[],https://mattstauffer.com/blog/why-i-wrote-my-book-with-oreilly/,"['wrote', 'laravel', 'book', 'publishing', 'oreilly', 'dont', 'writing', 'traditional', 'love', 'write', 'publisher']","In case you missed it, I finished the first draft of my book Laravel: Up and Running this weekend.
I've gotten a lot of questions about what the process was like working with O'Reilly, why I chose O'Reilly over self-publishing, and what syntax and system I'm using to write the book.
The Jay-Z EffectFirst, I love O'Reilly, have learned from them since I was a kid, and love the feeling of telling my friends and family that I'm writing a book for O'Reilly.
It helps my connections: I am now in the O'Reilly fold, with a connection to other O'Reilly authors and O'Reilly conferences.
The number one recommendation I would make if you want to write a book, traditional publisher or no: blog.",1510,
How I Wrote My First Technical Book — Susan Fowler,2016-10-05 00:00:00,['Susan Fowler'],https://www.susanjfowler.com/blog/2016/10/5/how-i-wrote-my-first-technical-book,"['susan', 'wrote', 'book', 'fowler', 'microservice', 'id', 'finished', 'writing', 'microservices', 'chapter', 'technical', 'work', 'write', 'process']","Well, I knew I would write a book, but I didn't know that I'd write this book.
Writing the table of contents was probably the hardest part of the writing process, but it was (now that I look back) the most important part.
On the weekends, I'd write for 3-8 hours (until my brain turned to mush).
Whenever I had the second draft of a chapter finished, I immediately sent it to several friends and coworkers who had (very generously!)
I figured out what I wanted to write, architected the book, and then sat down every single day and wrote until it was finished.",1450,
"Italians Rediscover Their Museums, With No Tourists in Sight",2020-06-03 00:00:00,['Elisabetta Povoledo'],https://www.nytimes.com/2020/06/03/arts/design/italy-museums-reopening.html?action=click&module=Features&pgtype=Homepage,"['tourists', 'visitorsthough', 'sight', 'toti', 'visit', 'walls', 'visitors', 'vatican', 'worlds', 'rome', 'unexpected', 'museums', 'italians', 'rediscover']","ROME — There was no red carpet, but even so, a cadre of photographers snapped frenziedly as the objects of their attention — the first visitors to the Vatican Museums when they reopened on Monday after the coronavirus lockdown — squirmed in the unexpected spotlight.
With travel between Italian regions restricted until Tuesday, it was a local lineup, ready to experience what many Romans dream of: a tourist-free visit to one of the world’s greatest — and most popular — museums, which last year drew nearly seven million visitors.
Though she lives in Rome, Simona Toti, a statistician, said she hadn’t seen the Sistine Chapel for years “because of the mobs.”While online reservations have shortened the mile-long queue that once snaked along the walls of Vatican City to the museum entrance, many Rome residents are still daunted by the crowds, and the crowding.
“Normally it’s so packed that you just can’t appreciate anything,” Ms. Toti said.",158,
"In Mathematics, It Often Takes a Good Map to Find Answers",2020-06-01 00:00:00,['Kevin Hartnett'],https://www.quantamagazine.org/in-math-it-often-takes-a-good-map-to-find-answers-20200601/,"['conjecture', 'mathematicians', 'mathematical', 'map', 'techniques', 'primes', 'takes', 'prime', 'know', 'good', 'problems', 'way', 'mathematics', 'problem', 'answers']","But Dimitrov cracked the problem by finding a novel way of combining techniques that have been around for more than 40 years.
“Math is really hard, and people sometimes overlook things.”So how do mathematicians know if a problem is currently impossible or just really hard?
If mathematicians have solved one problem, it boosts their confidence that they can solve another that looks kind of like it.
For example, two of the biggest open problems in the field of number theory are the twin primes conjecture and the Goldbach conjecture.
Experimental computations back up the conjecture, but mathematicians have no idea how to prove it — and they may never.",1471,
Why is Kubernetes getting so popular?,2020-05-29 00:00:00,"['Ricardo Aravena', 'Ryan Donovan', 'Ben Popper', 'John Biggs', 'Ryland Goldstein']",https://stackoverflow.blog/2020/05/29/why-kubernetes-getting-so-popular/?utm_source=Iterable&utm_medium=email&utm_campaign=the_overflow_newsletter,"['developers', 'running', 'p', 'getting', 'popular', 'example', 'type', 'resource', 'operator', 'cloud', 'kubernetes', 'yaml']","If you haven’t heard about Kubernetes yet, it’s a platform that allows you to run and orchestrate container workloads.
All the resources in Kubernetes that include Pods, Configurations, Deployments, Volumes, etc., can simply be expressed in a YAML file.
With this approach, you can keep all your Kubernetes YAML files under git repositories, which allows you to know precisely when a change was made, who made the change, and what exactly changed.
Having resources defined as YAML makes it super easy for cluster operators to change one or two numbers in a Kubernetes resource to change the scaling behavior.
With the help of the cloud-provider component, Kubernetes allows every cluster to integrate with the cloud provider it’s running on.",1747,
The 2020 Developer Survey results are here!,2020-05-27 00:00:00,"['Ben Popper', 'Ryan Donovan', 'Medi Madelen Gwosdz', 'Prashanth Chandrasekar']",https://stackoverflow.blog/2020/05/27/2020-stack-overflow-developer-survey-results/?utm_source=Iterable&utm_medium=email&utm_campaign=the_overflow_newsletter,"['results', 'survey', 'developers', 'overflow', 'world', 'python', 'developer', 'respondents', 'typescript', 'stack', 'interesting', 'work', '2020']","Depending on how you count it, this is the 10th year Stack Overflow has been conducting its annual developer survey.
That said, there are plenty of exciting, interesting, and amusing highlights from the 2020 Developer Survey, so let’s dive in!
While finding a solution on Stack Overflow saves developers time, developers spend a lot of time working.
In responses to this year’s survey, more than 15% of people said they find Stack Overflow at least somewhat more welcoming than last year.
As always, we’ll make the anonymized results of this year’s survey publicly available under the Open Database License (ODbL) shortly.",1191,
Women’s dress sizes demystified,2011-04-28 00:00:00,['Nathan Yau'],https://flowingdata.com/2011/04/28/womens-dress-sizes-demystified/,"['york', 'waist', 'dress', 'women', 'bust', 'brand', 'working', 'womens', 'sizes', 'demystified', 'line', 'length']","Women’s clothing sizes have always confused me.
My wife always has to try on an array of sizes, and it seems to vary by store.
For me, on the other hand, when I’m looking for pants, I just look for waist, length, and maybe cut.
As we’ve seen, men’s actual sizes can change by brand, but it looks a lot more confusing for women, as shown in this graphic from The New York Times.
The good news is that some companies are working on making it easier to figure out the right sizes.",197,
Protecting Lives & Liberty: How Contact Tracing Can Foil COVID-19 & Big Brother,,[],https://ncase.me/contact-tracing/,"['covid19', 'contact', 'translations', 'wymant', 'tracing', 'comic', 'protecting', 'translated', 'big', 'zipsources', 'youd', 'send', 'foil', 'lives', 'liberty', 'troncoso', 'help', 'brother', 'prof']","Accessible TranscriptsAs one page:If you'd like to help translate this comic, click here to see what translations have already been done!
If your language hasn't been done yet, send a Pull Request to that repo with your translated comic, or send it to .
💖Download this comic as a .zip!
Sources: DP-3T, TCN Protocol, Ferretti & Wymant et alCC0/Public DomainBy Nicky Case (site · patreon)With huge help from Prof Carmela Troncoso & Prof Marcel Salathé",82,
Curse of the Chocolate-Covered Broccoli (or: Emotion in Learning),2019-12-05 20:09:52+00:00,['Nicky Case'],https://blog.ncase.me/curse-of-the-chocolate-covered-broccoli-or-emotion-in-learning/,"['theory', 'cognitive', 'learning', 'emotion', 'broccoli', 'chocolatecovered', 'load', 'fun', 'thing', 'youre', 'curse', 'learn']","Like physical load, there's cognitive load: step-by-step instructions are a ""small"" load, while pure exploration is a ""heavy"" load.
According to Cognitive Load Theory, good education is giving a learner a fitting ""load"": one that's slightly beyond their comfort zone.
Richard Mayer has applied Cognitive Load Theory to create 10 empirically-based Principles for Multimedia Learning.
Cognitive Load Theory predicts these to be ""extraneous load"" that would hurt learning, but I think the dad jokes are necessary.
You remember above, when I said:That's the big gap in the original version of Cognitive Load Theory: it says nothing about emotionTurns out people have recently added emotion and motivation to Cognitive Load Theory.",1554,
