title,publish_date,authors,url,keywords,summary,word_count,category
London scientists build 'ultra broadband nearly three million times faster' than UK home fibre optic internet connections,2020-08-17 08:15:18+00:00,['Mark Blunden'],https://www.standard.co.uk/tech/london-scientists-build-ultra-broadband-a4524801.html,"['uk', 'internet', 'optic', 'ultra', 'broadband', 'nearly', 'team', 'networks', 'fibre', 'scientists', 'million', 'used', 'optical', 'speed', 'data', 'times', 'galdino', 'london']","S cientists in London claim to have achieved the world’s fastest-ever internet speed - quick enough download the entire Netflix library a split second.
A University College London-led team used amplifiers to enhance the way light carries digital data through fibre-optic broadband to achieve a record 178 terabits per second - almost three million times faster than the average UK home connection.
For the speed test, Dr Galdino sent computer-generated bits in a 25-mile fibre optic loop around a Bloomsbury lab.
It meant her super-speeds - the equivalent of 178 million megabits per second - were about 2.8 million times faster than the Ofcom-rated average 64mbps British home broadband connection.
“This is underpinning the next generation of communication systems.”A global race is underway to make ultra-speed broadband networks available commercially.",460,
This ailing scientist is trying to save his life by becoming world's first full-fledged cyborg,,['Ellie Zolfagharifard'],https://nationalpost.com/health/this-ailing-scientist-is-trying-to-save-his-life-by-becoming-worlds-first-full-fledged-cyborg,"['separate', 'life', 'wright', 'worst', 'fullfledged', 'voice', 'help', 'cyborg', 'stomach', 'losing', 'ailing', 'spent', 'scientist', 'save', 'body', 'way', 'worlds', 'trying']","In 2018, he “re-plumbed” his stomach so that he would no longer have to rely on a carer to eat or go to the bathroom.
“You can’t help but be impressed by the way he wants to take control,” says Marie Wright, his anaesthesiologist.
The problem was, it would mean losing his distinctive voice, and with it, his ability to connect fully with those he loved.
Prior to losing his voice, he spent hours recording words and sentences with the help of scientists at Edinburgh-based CereProc.
These have been used to create a synthetic voice that sounds almost like his original.",294,
Big achievements by a small manufacturer,2017-10-08 00:00:00,"['Dan Johnson', 'Chuck Watson Jr', 'Glenn Swiatek', 'Gordon W. Lester', 'Jimh In Ca', 'Miami Mike', 'Richard Chabot', 'John Schroeder']",https://generalaviationnews.com/2017/10/08/big-achievements-by-a-small-manufacturer/,"['lsa', 'usa', 'small', 'bristell', 'manufacturer', 'brm', 'aircraft', 'pounds', 'weight', 'achievements', 'milan', 'team', 'aero', 'big']","I write about the world of light aviation, a segment of recreational aircraft spanning hang gliders to Light-Sport Aircraft (LSA).
While all that misery was happening, BRM Aero of the Czech Republic was just forming.
In fact, the regulations do not prevent such use and Bristell USA can explain the details to buyers that might be interested.
Additionally, BRM Aero was one of the very first to implement the still-coming-to-market 135-hp Rotax 915iS engine.
Team BRM Aero was justifiably proud.",1427,
We’ve Seen New York’s White Flight Before,2020-08-26 12:50:00+00:00,['Talmon Joseph Smith'],https://www.theatlantic.com/culture/archive/2020/08/new-york-dead-to-whom/615673/,"['flight', 'yorks', 'white', 'york', 'life', 'leaving', 'essay', 'young', 'cities', 'city', 'yorker', 'seen', 'late', 'weve']","She meant, Do we want to be the rich white people who leave the besieged city because they can?
“Wealthy white people may be leaving cities for the suburbs, just as they did decades ago,” Eric Klinenberg, a sociology professor at New York University, told me.
In Central Harlem, ’80s and ’90s R&B still thumps from the late afternoon to the late evening, vibrating in your chest.
For now, residents linger outside for a while longer at dusk, soaking up as much of summer as possible.
Inhaling what still feels like their city, as though they can make it through this winter if they absorb enough of what’s left.",688,
Hiking Time Calculator,,[],https://trailsnh.com/tools/hiking-time-calculator.php,"['settings', 'rule', 'calculator', 'hiking', 'minutes', 'feet', 'based', 'plus', 'mile', '30', 'naismiths']","How To Calculate Hiking TimeI calculate Your Estimated Hiking Time by making an adjustment to Naismith's Rule based on your settings above.
The adjustment (currently calculated as ) uses a sliding scale to add or subtract effort.
Your settings are currently set as: pace = , treadway = , and pack weight = .
Naismith's Rule estimates hiking time on reasonably easy ground based on 19½ minutes for every mile, plus 30 minutes for every 1,000 feet of ascent.
Book Time estimates hiking time in the mountains based on 30 minutes for every mile, plus 30 minutes for every 1,000 feet of ascent.",110,
This giant glowing orb is the world’s first floating Apple Store,2020-08-24 00:00:00,"['Nick Statt', 'Aug']",https://www.theverge.com/2020/8/24/21399749/apple-store-retail-singapore-floating-design-marina-bay-sands,"['singapores', 'floating', 'marina', 'giant', 'glowing', 'singapore', 'apple', 'location', 'retail', 'orb', 'store', 'stores', 'bay', 'sands', 'worlds']","The iPhone maker’s newest retail location, located in Singapore on the city-state’s waterfront and known officially as Apple Marina Bay Sands, can claim a world’s first title: it’s the only Apple retail shop on the planet that floats on water.
The location, part of the luxury hotel and resort of the same name, is Singapore’s third Apple Store following Orchard Road, which opened as Singapore’s first in 2017, and Apple Jewel Changi Airport, located in the world-famous retail sector of Singapore’s transportation hub that also features the world’s tallest indoor waterfall.
During the daytime, the new Marina Bay Sands store appears to look like an odd spacecraft of some sort or perhaps some form of futuristic theater.
We don’t have a lot of details on the location, like how exactly the interior is structured.
We do know that the store is Apple’s 512th retail shop globally, and that it’s opening sometime soon.",464,
How to Create a Mind-Blowing Presentation? (Part 1 of 3) — Lightdotlab,,[],https://www.lightdotlab.com/blog/2020/how-to-create-a-mind-blowing-presentation-part-1-of-3?utm_campaign=Data_Elixir&utm_source=Data_Elixir_299,"['work', 'lightdotlab', 'create', 'minutes', 'substance', 'wanted', 'elements', 'feel', 'mindblowing', 'share', 'data', 'presentation', 'audience']","45 minutes presentation, 45+ hours of preparation.
Well, here’s my attempt to de-construct what went into my presentation using the WHY-WHAT-HOW framework to share what’s possible.
ConfidentI wanted my audience to gain confidence in their ability to create better data visualisations.
EngagedI wanted my audience to feel engaged throughout my presentation.
Now that I had clearly set out WHAT I wanted my audience to experience, I had to figure out and create the elements that would deliver those experiences.",1104,
The technology that changed air travel,2018-11-18 22:53:55+00:00,"['Follow On Twitter', 'Taimur Abdaal']",https://retool.com/blog/air-travel-software/?mc_cid=b6d9ddc637&mc_eid=e7c75333ad,"['systems', 'airlines', 'flight', 'technology', 'fare', 'agents', 'seats', 'gds', 'changed', 'system', 'airline', 'air', 'travel']","A lot has changed about air travel since it went mainstream in the 1930s.
As air travel became more and more popular, though, the reservation system became more and more of a bottleneck.
The trajectory of air travel changed after a chance meeting between the president of American Airlines, and an IBM salesman — on an American flight.
As the middleman, the GDS charged airlines and travel agents a fee for each booking.
The total profit generated by travel agents in 2015 was $2B.",2306,
Ikea turned a virtual influencer into a physical installation,2020-08-31 00:00:00,"['Andrew Webster', 'Aug']",https://www.theverge.com/2020/8/31/21408626/ikea-tokyo-imma-virtual-influencer,"['cg', 'living', 'instagram', 'physical', 'installation', 'turned', 'virtual', 'ikea', 'influencer', 'imma', 'floor', 'harajuku', 'real']","This past weekend, the Ikea Harajuku location in Tokyo was home to something unique: an installation starring a virtual person.
Meanwhile, a view into her bedroom was streamed on a screen on the second floor, viewable from Harajuku Station.
Of course, these weren’t real living spaces, since Imma is a CG model and not an actual human.
But Ikea says that it created the installation using LED screens inside of the physical rooms, which were “curated” by Imma, to give the appearance of Imma being in a real place.
Imma, meanwhile, is run by a talent agency for “virtual humans” and is active on both Instagram and TikTok.",219,
,,,providencejournal.com,,,,
Japanese convenience store chain begins testing remote controlled robot staff in Tokyo,2020-08-29 00:00:00,['Master Blaster'],https://soranews24.com/2020/08/29/japanese-convenience-store-chain-begins-testing-remote-controlled-robot-staff-in-tokyo/,"['remote', 'testing', 'staff', 'convenience', 'tokyo', 'modelt', 'working', 'help', 'japanese', 'controlled', 'family', 'robot', 'store', 'chain', 'telexistence', 'watch', 'way', 'locations']","For years now the convenience store industry in Japan has been facing a labor crisis.
Lawson is currently testing self-payment systems and Family Mart has enlisted the help of Model-T.
In this way, however, a single robot operator could keep the drinks stocked at several locations throughout the day while the in-house staff focus on the customers.
“I would love to see a remote-controlled robot working at a convenience store!”“Why do they have it working in the back?
Source: Telexistence, FamilyMart, Impress Watch, Hachima KikoTop image: YouTube/Telexistence Inc.● Want to hear about SoraNews24’s latest articles as soon as they’re published?",531,
Writers' rooms,2020-09-01 00:00:00,[],https://www.theguardian.com/books/series/writersrooms?ml_subscriber=1500781314268206182&ml_subscriber_hash=a6u1&utm_source=newsletter&utm_medium=email&utm_campaign=shouting_from_the_shed_58&utm_term=2020-09-01,"['google', 'term', 'search', 'writers', 'rooms']","What term do you want to search?
Search with google",10,
"Jackson Heights, Queens: Walk Where the World Finds a Home",2020-08-27 00:00:00,['Michael Kimmelman'],https://www.nytimes.com/interactive/2020/08/27/arts/design/jackson-heights-queens-virtual-walk-tour.html?campaign_id=167&emc=edit_ah_20200828&instance_id=21705&nl=at-home&regi_id=67929948&segment_id=37129&te=1&user_id=40960da8fc6ccb4f2b72348bd033153e,"['finds', 'world', 'jackson', 'heights', 'walk', 'neighborhood', 'avenue', 'city', 'queens', 'plaza', 'street', 'roosevelt', 'indian', 'money']","At that time, he was 14 and, like the city, Jackson Heights was going through a rough patch.
Burmese people living in Jackson Heights would make trips home and smuggle goods back.
For Jackson Heights, it’s a good thing that there is diversity of income as well as of ethnicity.
It was the invention of a Jackson Heights resident (an unemployed architect) named Alfred Butts.
There are some really unlovely buildings and shabby dwellings in Jackson Heights.",3763,
"A Walk Through Harlem, New York’s Most Storied Neighborhood",2020-08-20 00:00:00,['Michael Kimmelman'],https://www.nytimes.com/2020/08/20/arts/design/harlem-virtual-tour.html?action=click&module=RelatedLinks,"['harlem', 'yorks', 'york', 'moved', 'wider', 'walk', 'neighborhood', 'studio', 'design', 'chelsea', 'wellwe', 'storied', 'live', 'won', 'london']","They turn the street into a kind of stage and also make the sidewalks seem wider, lighter.
You live in London and Accra as well.
That’s when I started coming to Harlem all the time, wanting to understand it better.
So when I won the commission to design the Studio Museum, I moved with my family to 119th Street.
When I moved here I wanted to live in the middle of things, which is how I landed in Chelsea.",229,
Why Did I Go Silent?,,['Leandra Medine Cohen'],https://leandramcohen.substack.com/p/why-did-i-go-silent,"['think', 'responsibility', 'man', 'repeller', 'ive', 'understand', 'really', 'im', 'silent', 'way', 'know']","At the beginning of the pandemic, a number of employees were laid off from Man Repeller.
Our conversation started to show me that I didn’t really understand the responsibility that comes with leadership.
What they’ve made — delightful and uplifting, but still illuminating, smart and so real — is a beautiful depiction of a less me-centered Man Repeller.
But wait, why did you go silent?
To close the loop on where I started, with the question of why I’ve gone silent: it’s because fear has frozen me.",1887,
20 underground and secret NYC attractions you need to check out,,"['Devin Gannon', 'Camila Vasconcellos']",https://www.6sqft.com/20-underground-and-secret-nyc-attractions-you-need-to-check-out/,"['secret', 'known', 'york', 'park', 'check', 'city', 'nyc', 'used', '20', 'street', 'tunnel', 'attractions', 'store', 'need', 'building', 'underground']","20 underground and secret NYC attractions you need to check outWhile visiting the major, most popular attractions of New York City can be fun, it can also be stressful, overwhelming and full of selfie-taking tourists.
To go beyond the tourist-filled sites and tour the city like you’re seeing it for the very first time, check out 6sqft’s list ahead of the 20 best underground, secret spots in New York City.
Detached from the rest of New York City, the bay is covered with thousands of broken bottles, shards of glass, and other indecomposable remains.
Radio City’s secret apartmentRadio City Music Hall, which opened in 1932, is a New York City icon home to the famous Rockettes.
Midtown’s 25-foot waterfallSqueezed in between Second and Third Avenues on East 51st Street sits a vest-pocket park known as Greenacre Park.",3135,
The 22 Best Restaurants in Chinatown,,"['Tae Yoon', 'Updated On At Pm']",https://www.thrillist.com/eat/new-york/chinatown/best-chinatown-restaurants-nyc,"['chinatown', 'available', 'menu', 'order', 'restaurants', 'best', 'outdoor', 'chicken', 'noodles', 'soup', 'rice', 'seating', 'pork', '22']","Food & Drink The 22 Best Restaurants in Chinatown Help save the historic neighborhood, now back and better than ever with plenty of outdoor seating.
What can be considered as one of Manhattan’s ultimate dim sum experiences has reopened with outdoor seating and all of your Cantonese-style familiar favorites (sans the roving carts).
What can be considered as one of Manhattan’s ultimate dim sum experiences has reopened with outdoor seating and all of your Cantonese-style familiar favorites (sans the roving carts).
The menu includes rice bowls, soup, noodle soup, rice cakes, and specialty items like savory pan fried oyster cake and salt & pepper chicken.
The menu includes rice bowls, soup, noodle soup, rice cakes, and specialty items like savory pan fried oyster cake and salt & pepper chicken.",4552,
Uncovering the Best Food in New York City's Chinatown,,[],https://www.vice.com/en_us/article/pax739/uncovering-the-best-food-and-restaurants-in-new-york-city-chinatown,"['chinatown', 'tea', 'york', 'restaurant', 'took', 'sum', 'citys', 'best', 'wah', 'parlor', 'uncles', 'uncovering', 'tang', 'restauranteur', 'wilson', 'food']","After the September 11 attacks, Wilson Tang decided to leave his corporate job and become a restauranteur.
He took over his uncle's dim sum restaurant, Nom Wah Tea Parlor, and dedicated himself to incorporating the neighborhood's hidden culinary gems onto the menu.",44,
"Testing Three Recipes on the Legendary $1,500 Thermomix — The Kitchen Gadget Test Show",,[],https://www.youtube.com/watch?v=6DlgvuhA5kI,"['recipes', 'testing', '1500', 'legendary', 'gadget', 'test', 'kitchen', 'thermomix']",,0,
Can Americans Visit Mexico Right Now?,,[],https://www.afar.com/magazine/can-americans-visit-mexico-right-now,"['border', '21', 'americans', 'visit', 'mexico', 'states', 'covid19', 'right', 'united', 'puerto', 'vallarta', 'travelers', 'travel']","We’ve seen tales on social media of travelers at Mexico resorts experiencing socially distanced buffets and evening shows.
If you’re confused, you have good reason to be: As part of an agreement enacted on March 21, Mexico travel restrictions have been limited to land travel only.
In early September, that was downgraded to a Level 3—Reconsider Travel advisory for Mexico, due to COVID-19 and crime.
Until the ban is officially lifted, how are Americans getting to Cancun, Los Cabos, Puerto Vallarta?
Upon arrival in Mexico, travelers face health screenings like temperature checks—Cancun’s airport has thermographic cameras that register travelers with fevers (you might not even notice they’re taking your temperature).",782,
POTO diary: the Perimeter League,,[],https://www.robinsloan.com/overworld/week/perimeter-league/,"['world', 'heroes', 'video', 'poto', 'different', 'games', 'hero', 'game', 'league', 'overworld', 'perimeter', 'diary']","It is an urgent matter, he says: the Perimeter League must be reassembled.
The Perimeter League fought to kept the dead bottled up inside the Underworld.
Many members of the Perimeter League have, in their retirements, learned that.
Also, two cards of the major arcana have been combined into one hero of the Perimeter League: for Secret Reasons.
From Oakland,RobinThis has been an edition of my video game development diary, sent by email every few weeks.",2241,
Archetype creation,,[],https://docs.google.com/document/d/1ZtkqPmpK6rhHwNlFJxBo40aL00RptUEyZa9UZNFqGuU/edit,"['changesview', 'google', 'creation', 'docs', 'details', 'displayed', 'cant', 'archetype', 'features', 'dropped', 'word']",Some Word features can't be displayed in Google Docs and will be dropped if you make changesView details,20,
Writing More Idiomatic and Pythonic Code,2020-09-01 14:09:37.504000+00:00,['Martin Heinz'],https://towardsdatascience.com/writing-more-idiomatic-and-pythonic-code-c22e900eaf83,"['lists', 'python', 'code', 'pythonic', 'value', 'multiple', 'functions', 'using', 'values', 'idiomatic', 'writing', 'function']","Writing More Idiomatic and Pythonic CodeIdioms and conventions that will make your Python code readable, effective, concise and reliable.
The Python community often uses terms like Pythonic or when describing code that follows certain (natural, proper) style and conventions.
ConclusionI definitely recommend using all of the above idioms and tips in your Python code and I believe these will make your code more Pythonic and idiomatic.
So, use idioms to make your code more readable, concise and effective and not just because it’s idiomatic.
In the same way, use language specific features of Python to improve your code, not just to make it more Pythonic.",1947,
Google Maps is getting a lot more detail,2020-08-18 00:00:00,"['Jon Porter', 'Aug']",https://www.theverge.com/2020/8/18/21373363/google-maps-redesign-detail-natural-features-environment?scrolla=5eb6d68b7fedc32c19ef33b4,"['google', 'detailed', 'york', 'world', 'update', 'getting', 'natural', 'cities', 'lot', 'street', 'maps', 'features']","Google Maps is being redesigned to make it easier to distinguish between natural features in the environment, whether they’re mountainous ice caps, deserts, beaches, or dense forests.
Google says the new maps will be available in the 220 countries and territories currently supported by Google Maps, “from the biggest metropolitan areas to small, rural towns.” Google says that street maps are also getting more detailed in select cities.
Google says it used satellite imagery as the basis for its redesigned maps and that this has had a “new color-mapping algorithmic technique” applied to it.
Along with the changes it’s made to the natural world, Google is also making its street maps more detailed in select cities.
Google says the more detailed maps of natural features will be rolling out starting this week around the world, and it adds that you’ll need to “zoom out” to be able to see them.",330,
Longevity FAQ — Laura Deming,,[],https://www.ldeming.com/longevityfaq,"['investigators', 'longer', 'lifespan', 'fasting', 'works', 'variety', 'longevity', 'diet', 'deming', 'intake', 'total', 'live', 'laura', 'faq']","Caloric Restrictionat a glance: eating less, in a variety of ways, can make you live longer - but is your body just using number of calories as a signal?
To their surprise, this actually made the rats live longer!
For the first time, we changed the environment of an animal to make it live longer than it normally would.
If you take many genetically distinct mouse strains and put them on the same diet (cutting calories by ~40%), sometimes fewer than 1/5 of the mouse strains live longer.
Decreasing food intake by too much will result in starvation, so finding a diet that works can depend on the situation.",312,
Game Feeling & 8 Kinds of Fun,,[],https://www.riotgames.com/en/urf-academy/fun-and-feeling,"['walk', 'different', 'players', 'player', 'games', 'feeling', 'game', 'kinds', 'fun', 'evoke', 'emotions']","""Game Feeling & 8 Kinds of Fun"" focuses on the player portion of the Game Design Framework.
In this module we discuss the holistic gameplay experience that games should always deliver, framed from the player perspective.
We want students to walk away understanding that games are created to evoke emotions in players, and that the same game can evoke different kinds of emotions in different players.
We also delve into the eight different types of fun:",75,
"The Met Is Back, and So Are We",,"['Alexandra Schwartz', 'Alexandra Schwart', 'Peter Schjeldah', 'Andrea K. Scot']",https://www.newyorker.com/culture/culture-desk/the-met-is-back-and-so-are-we,"['wing', 'american', 'went', 'art', 'room', 'objects', 'met', 'past', 'museum', 'native', 'long']","One of the supreme pleasures of being a New Yorker has always been having the power to pop into the Met at any hour, for any amount of time, for any reason.
Their whole glorious civilization is gone, their tombs raided, and now people rush by their kings and queens on their way to get a sandwich in the American wing.
At that point, drained and restored, I meant to leave, but instead I wandered into the sculpture court of the American wing.
The sculpture has been ironized, to an extent, by an accompanying poem by Livia Corona Benjamin, part of a Met initiative called Native Perspectives.
The Met disagreed and denied.",1175,
7 Terminal Commands That Will Just Make You Smile,2020-02-27 15:14:10.401000+00:00,['Coder S Cat'],https://medium.com/better-programming/7-terminal-commands-that-will-just-make-you-smile-3f5bc8778080,"['tool', 'tools', 'workyou', 'terminal', 'commands', 'tutorials', 'terminals', 'smilethese', 'command', 'unsplashshell', 'smile', 'word']","7 Terminal Commands That Will Just Make You SmileThese tutorials don’t always have to be practicalPhoto by Mateus Campos Felipe on Unsplash.
Shell command is a powerful tool for improving a developer’s productivity.
There are also some really funny command tools that will make you smile after a long day of work.
You can play word games in terminals, create a beautiful ASCII picture, and more.
Let’s have a look.",75,
Magic Leap’s lost work The Last Light gets a surprise release after its developers were laid off,2020-08-20 00:00:00,"['Jay Peters', 'Aug']",https://www.theverge.com/2020/8/20/21378202/magic-leap-mixed-reality-game-the-last-light-now-available,"['developers', 'surprise', 'leaps', 'release', 'lost', 'light', 'gets', 'magic', 'abovitz', 'young', 'laid', 'leap', 'employee', 'work']","The Last Light, Magic Leap’s in-house mixed reality experience thought to be lost after nearly everyone who made it was laid off, got a surprise — and official — release this week.
(We spotted the release thanks to a tweet from former Magic Leap employee Alexandria Heston.)
“It is not a game or a tech demo,” said former Magic leap employee Anastasia Devana on LinkedIn.
Then, on April 22nd, Magic Leap reportedly laid off around 1,000 employees, including many of the game’s developers.
(Abovitz said he would step down from Magic Leap in May, and has since been replaced by former Microsoft exec Peggy Johnson.)",298,
Thoughts on 2 Years as a Remote Robotics Consultant,,['Robotics Consultant'],https://msadowski.github.io/2-years-remote-consulting/,"['remote', 'thoughts', 'ive', 'consultant', 'projects', 'working', 'client', 'im', 'clients', 'upwork', 'work', 'project', 'robotics']","Thoughts on 2 Years as a Remote Robotics ConsultantIt’s that time of year again when I’m thinking back on the journey I set up for myself by deciding to go into Robotics Consulting.
Looking back on all my clients, I’ve worked with many interesting people all around the world, mostly helping them to develop software for mobile robots and drones.
Remote RoboticsPeople often ask me how I work on robotics projects remotely (I’ve been doing this since day 1 of my consultancy).
To save time on browsing Upwork projects, I set up an RSS feed with the keywords that interest me.
Closing thoughtsHaving worked for over 2 years as a Remote Robotics Consultant, I can’t imagine doing anything else.",2473,
