title,publish_date,authors,url,keywords,summary,word_count,category
"From White Gloves to Latex, the Doormen of New York",2020-03-23 00:00:00,['Guy Trebay'],https://www.nytimes.com/2020/03/23/style/doormen-coronavirus.html,"['ventura', 'virus', 'life', 'york', 'white', 'latex', 'whitegloved', 'building', 'doormen', 'gloves', 'worked', 'women', 'walkers']","They are the white-gloved sentries, standing guard at New York City’s better addresses, so signature a feature of life here that we tend to forget that in other metropolitan centers like Paris, London, Chicago or Boston uniformed doormen (and, less often, women) barely exist.
They form a small army, some 35,000 residential doormen, concierges, porters, handymen and supers represented by a powerful union, 32BJ.
Yet as protectors of the border between public and private, doormen play a role crucial to the currents of the metropolis, one never more evident than now when the front line of a global pandemic is one’s threshold.
“Yes, it’s a job, but we also try to keep the building as a home,” said Alberto Ventura, 65, who has worked the door at the same Park Avenue building for 42 years.
“With the virus, we’re trying to take it a day at a time and be as calm as we can.”",195,
Eight marvelous and melancholy things I've learned about creativity,,[],https://theoatmeal.com/comics/creativity_things,"['minute', 'read', 'ive', 'marvelous', 'subscribe', 'melancholy', 'inboxeight', 'creativity', 'things', 'learned']","Subscribe and get comics in your inbox.
Eight marvelous and melancholy things I've learned about creativity A 10 minute read.",21,
Why luxury fashion houses still open restaurants,,[],https://www.voguebusiness.com/consumers/luxury-fashion-houses-restaurants-louis-vuitton-tiffany-bergdorf-goodman-browns,"['houses', 'customers', 'york', 'restaurant', 'business', 'luxury', 'café', 'restaurants', 'opened', 'fashion', 'open', 'store', 'brands']","Key takeaways:Luxury brands, including Louis Vuitton, Tiffany & Co., Bergdorf Goodman and Browns have opened or will open new restaurants this year in cities globally.
That hasn’t stopped fashion brands from opening eateries through which they can find new ways to woo customers.
As high-touch customer service becomes a point of differentiation for luxury brands, restaurants serve a new purpose.
The ways fashion houses operate their restaurants help protect their bottom lines from the finicky nature of the industry.
People can do their own research.”Not all fashion restaurants survive.",1623,
Audible just made hundreds of titles completely free to help during coronavirus crisis,2020-03-20 00:00:00,['Thomas Ling'],https://www.radiotimes.com/news/radio/2020-03-20/audible-just-made-hundreds-of-titles-completely-free-to-help-during-coronavirus-crisis/,"['titles', 'available', 'free', 'help', 'stream', 'newton', 'audible', 'coronavirus', 'hundreds', 'crisis', 'closed', 'schools', 'completely', 'long', 'narrated']","Good news for those stuck at home in isolation: Audible is making hundreds of titles available for free during the coronavirus pandemic.
AdvertisementThe audiobook platform has said that, for as long as schools are closed, anyone can listen to a vast selection of its titles.
This means books read by Westworld’s Thandie Newton and Downton Abbey’s Dan Stevens are available to stream at no cost at all.
On the site, Audible says: “For as long as schools are closed, we’re open.
You can also sign up for a free 30-day trial on Audible and explore even more titlesAdvertisement",254,
Audible Stories: Free Audiobooks for Kids,,[],https://stories.audible.com/discovery,"['audible', 'free', 'kids', 'audiobooks']",,0,
10 Types of Odd Friendships You're Probably Part Of — Wait But Why,2014-12-10 00:00:00,['View All Posts Tim Urban'],https://waitbutwhy.com/2014/12/10-types-odd-friendships-youre-probably-part.html,"['wait', 'friends', 'life', 'friend', 'probably', 'tier', 'friendship', 'odd', 'dont', 'friendships', 'really', 'youre', 'person', 'types']","__________When you’re a kid, or in high school, or in college, you don’t really work too hard on your friend situation.
Towards the bottom of the mountain in the orange zone, you have your Tier 3 friends—your Not Really friends.
Rock friendships don’t just make us happy—they’re the thing (along with rock family and romantic relationships) that makes us happy.
If you’re in your mid-20s or older, your current rocks are probably the only ones you’ll ever have.
Your rock friendships don’t warrant 2x the time you give to your other friends—they warrant 5 or 10x.",4616,
Does your web app need a front-end framework?,2020-02-03 00:00:00,"['Max Pekarsky', 'Demian Brecht', 'Drew Shafer', 'Rising Odegua', 'Tomi Mester', 'Tim Lehnen']",https://stackoverflow.blog/2020/02/03/is-it-time-for-a-front-end-framework/,"['web', 'javascript', 'code', 'match', 'framework', 'design', 'end', 'app', 'does', 'frontend', 'data', 'frameworks', 'need', 'components']","A few years ago, while working on a side project, Hackterms, my own…You’ve likely heard about front-end frameworks.
Quick aside: “front-end framework” gets a hyphen since it’s a compound adjective.
For example, if the JSON has nine game records, we render nine <Match> components, with match data automatically inserted.
Disadvantages and alternativesOf course, like any tool, a front-end framework isn’t always the right solution for your application.
Hopefully, this overview has given you an idea of the problems a front-end framework solves, and whether it’s the right fit for your next project.",3199,
How We Improved Data Discovery for Data Scientists at Spotify,2020-02-27 00:00:00,['Published Andrew Maher'],https://labs.spotify.com/2020/02/27/how-we-improved-data-discovery-for-data-scientists-at-spotify/?utm_campaign=Data_Elixir&utm_source=Data_Elixir_274,"['spotify', 'improved', 'datasets', 'discovery', 'scientists', 'lexikon', 'used', 'data', 'insights', 'dataset', 'knowledge', 'users']","How We Improved Data Discovery for Data Scientists at SpotifyPublished by Andrew MaherAt Spotify, we believe strongly in data-informed decision making.
Our team decided to focus on this specific issue by iterating on Lexikon, with the goal to improve the data discovery experience for data scientists and ultimately accelerate insights production.
Within the context of data discovery, a data scientist with low-intent has a broad set of goals and might not be able to identify exactly what it is they’re looking for.
Our belief was that by making these types of entities more explorable, we would open up new pathways for data discovery.
Since making these improvements to the data discovery experience in Lexikon we see that adoption of Lexikon amongst data scientists has increased from 75% to 95%, putting it in the top 5 tools used by data scientists.",2979,
,,,https://oneomgeu-my.sharepoint.com/personal/george_maynard_annalect_com/Documents/2.%20Focus/Covid-19%20Response/Helping%20CMOs%20Navigate%20Coronavirus%20-%20March%202020%20external.pdf?CT=1585745972685&OR=ItemsView,,,,
GitLab's Guide to All-Remote,,[],https://about.gitlab.com/company/culture/all-remote/guide/?fbclid=IwAR3HRXbwhY6GSCEEeONZNYD39Nh6veGPHr5HZ3iO2OqrbyRJ-TYLCX1IeI0,"['remote', 'gitlabs', 'companies', 'gitlab', 'guide', 'working', 'company', 'allremote', 'team', 'communication', 'work', 'members']","But we also recognize that being part of an all-remote company isn't for everyone.
Our long-term vision for remote workLearn more about GitLab's long-term vision for remote work, and why we can embrace the future of work right now.
Being an all-remote company enables us to hire the world's best talent, not just the best talent from a few cities.
As the largest all-remote company in the world, we have developed a custom certification program to test and apply knowledge attained throughout the all-remote section of the handbook.
Remote work guides for teamsThese remote work guides are written specifically for external parties who wish to learn how specific divisions/departments function in a remote environment.",2648,
Tussen Kunst & Quarantaine (@tussenkunstenquarantaine) • Instagram photos and videos,,[],https://www.instagram.com/tussenkunstenquarantaine/?utm_source=ig_embed,"['photos', 'instagram', 'quarantaine', 'kunst', 'tussen', 'videos', 'tussenkunstenquarantaine']",,0,
Sarah Hoover's Empire,2019-05-02 06:32:09+00:00,[],https://theartgorgeous.com/?p=29722,"['sarah', 'world', 'read', 'art', 'x', 'empire', 'really', 'hoovers', 'shirt', 'watch', 'love', 'work', 'course']","Artist liaison/art dealer, New York CitySarah Hoover has kicked off her career in Larry Gagosian’s empire already years back while still in graduate school (Cultural Theory – chapeau!)
Being undoubtedly among the art world ladies with the best style (and btw being married to one of the coolest artists: Tom Sachs), today, Sarah is mainly in charge of artist liaison and looking after (and hanging around with) some of the gallery’s most exciting artists.
This song brings you in a good mood straight away…Anything by BeyonceFavourite art x brand collaboration…Cindy Sherman x Louis VuittonYou first post on Instagram…My dog Napoleon!
Oh and by the way, they are all really, really nice and supportive.
Art world gent I would love to have lunch with…John Richardson!",494,
NYC’s Newest Nightclub Is Online-Only — but With a Cover Charge and Dress Code,2020-04-02 00:00:00,"['Tanay Warerkar', 'Luke Fortney', 'Eater Staff', 'Erika Adams', 'Apr']",https://ny.eater.com/2020/4/2/21203204/nyc-online-club-quarantee-coronavirus-dancing-nightlife,"['nycs', 'onlineonly', 'code', 'newest', 'instagram', 'world', 'dress', 'video', 'djs', 'nightclub', 'club', 'clubs', 'dj', 'party', 'cover', 'charge', 'online', 'dance']","But the same can’t be said for a new online club called Quarantee that hosts parties on the web video platform Zoom.
Here, all the usual trappings of an uber-exclusive NYC club remain: There’s a doorman who checks that you’ve paid the $10 cover charge.
The online club also requests nightclub attire for attendees, a way to keep up the vibe.
Three hundred people, including comedian Jason Nash, showed up to the first dance party last week, which was hosted by popular NYC-based DJ Lohrasp Kansara.
For now, there’s a promise of a party on Zoom with hundreds of people dancing the night away from the privacy of their homes.",544,
Atomic Design,2013-06-10 07:28:03-07:00,['Brad Frost'],https://bradfrost.com/blog/post/atomic-web-design/,"['systems', 'web', 'atoms', 'design', 'start', 'molecules', 'atomic', 'form', 'organisms', 'templates']","I wrote a book called Atomic Design that dives into this topic in more detail, which you can buy as an ebook.
That’s the basic gist of atomic design.
What is Atomic DesignAtomic design is methodology for creating design systems.
Atomic design provides a clear methodology for crafting design systems.
Brad Frost – Atomic Design – beyond tellerrand 2013 from beyond tellerrand on Vimeo.",1315,
Are you a robot?,2020-04-01 00:00:00,[],https://www.bloomberg.com/news/articles/2020-04-01/how-social-media-influencers-are-affected-by-coronavirus-shutdown,"['sure', 'service', 'happenplease', 'review', 'policy', 'robot', 'supports', 'terms', 'information', 'javascript', 'loading']","Why did this happen?
Please make sure your browser supports JavaScript and cookies and that you are not blocking them from loading.
For more information you can review our Terms of Service and Cookie Policy.",35,
Are you a robot?,2020-03-30 00:00:00,[],https://www.bloomberg.com/news/articles/2020-03-30/geffen-s-superyacht-isolation-draws-outrage-while-industry-sinks,"['sure', 'service', 'happenplease', 'review', 'policy', 'robot', 'supports', 'terms', 'information', 'javascript', 'loading']","Why did this happen?
Please make sure your browser supports JavaScript and cookies and that you are not blocking them from loading.
For more information you can review our Terms of Service and Cookie Policy.",35,
Are you a robot?,2020-03-12 00:00:00,[],https://www.bloomberg.com/news/articles/2020-03-12/instagram-vs-reality-travel-influencers-gloss-over-coronavirus,"['sure', 'service', 'happenplease', 'review', 'policy', 'robot', 'supports', 'terms', 'information', 'javascript', 'loading']","Why did this happen?
Please make sure your browser supports JavaScript and cookies and that you are not blocking them from loading.
For more information you can review our Terms of Service and Cookie Policy.",35,
Celebrity Culture Is Burning,2020-03-30 00:00:00,['Amanda Hess'],https://www.nytimes.com/2020/03/30/arts/virus-celebrities.html,"['public', 'burning', 'woman', 'wealth', 'wonder', 'wall', 'wallpaper', 'zoë', 'celebrity', 'watch', 'culture', 'work', 'stay']","“Staying home is my superpower,” the “Wonder Woman” star Gal Gadot reported from her walk-in closet.
Ryan Reynolds urged his fans to “work together to flatten the curve” from within his rustic loft.
When Jennifer Lopez posted a video of her family sheltering in the backyard of Alex Rodriguez’s vast Miami compound, the public snapped.
Among the social impacts of the coronavirus is its swift dismantling of the cult of celebrity.
The famous are ambassadors of the meritocracy; they represent the American pursuit of wealth through talent, charm and hard work.",243,
"""The work-from-home experiment could have a far reaching impact on office culture""",2020-03-25 00:00:00,['Tom Ravenscroft'],https://www.dezeen.com/2020/03/25/work-from-home-coronavirus/?utm_medium=email&utm_campaign=Dezeen%20Weekly%20668&utm_content=Dezeen%20Weekly%20668+CID_835d62ddc0f55d4bd73fcd5aff576508&utm_source=Dezeen%20Mail&utm_term=Read%20more,"['remote', 'companies', 'workfromhome', 'flexible', 'dezeen', 'impact', 'reaching', 'far', 'world', 'working', 'office', 'coronavirus', 'culture', 'work', 'experiment']","The mass work-from-home experiment imposed on us by coronavirus could finally force companies to embrace remote working, says Tom Ravenscroft.
The coronavirus outbreak is the most dramatic disruption to office working culture in our lifetimes.
Companies across the world are being forced to embrace remote working and the digital technology that supports it.
Certainly, there will be hiccups and barriers to smooth remote working and technology is not quite up to the task.
This wide adoption of remote working also has the potential to fulfil some of the internet's promise of democratising working.",1156,
Jure Tovrljan redesigns iconic logos to reflect a world under coronavirus,2020-03-25 00:00:00,['Jennifer Hahn'],https://www.dezeen.com/2020/03/25/coronavirus-logos-jure-tovrljan/?utm_medium=email&utm_campaign=Dezeen%20Weekly%20668&utm_content=Dezeen%20Weekly%20668+CID_835d62ddc0f55d4bd73fcd5aff576508&utm_source=Dezeen%20Mail&utm_term=Read%20more,"['world', 'graphic', 'tovrljan', 'spaced', 'logos', 'jure', 'play', 'iconic', 'coronavirus', 'redesigns', 'brands', 'reflect', 'started', 'including', 'starbucks', 'social']","Slovenian graphic designer Jure Tovrljan has redrawn the logos of brand including the Olympics, Starbucks and Nike to show how the coronavirus has impacted our everyday lives.
In the 12-part series Tovrljan has redesigned well-known brands' logos to reflect how the pandemic has affected people and businesses around the world.
""I believe that iconic logos are a visual message we're all familiar with,"" Tovrljan told Dezeen.
These days, people can tend to pay more attention to big brands than world leaders.""
The overlapping circles of the Mastercard logo, as well as the iconic rings of the Olympic flag are reimagined safely spaced apart.",404,
"Dear Jeff Bezos, instead of firing me, protect your workers from coronavirus",2020-04-02 00:00:00,['Chris Smalls'],https://www.theguardian.com/commentisfree/2020/apr/02/dear-jeff-bezos-amazon-instead-of-firing-me-protect-your-workers-from-coronavirus,"['walkout', 'jeff', 'sick', 'instead', 'paid', 'warehouse', 'firing', 'protect', 'dear', 'wanted', 'dont', 'coronavirus', 'told', 'workers', 'bezos', 'amazon', 'work']","Dear Jeff Bezos,When I applied to work at Amazon, the job description was simple.
Now, because of Covid-19, we’re being told that Amazon workers are “the new Red Cross”.
At the beginning of March, before the first confirmed case of coronavirus at the facility, I noticed people were getting sick.
The result is that Amazon employees are going to work sick as dogs just so they can earn $2 per hour on top of their regular pay.
The thing is, it won’t work.I am getting calls from Amazon workers across the country and they all want to stage walk-outs, too.",1106,
‘Nixon in China’ at the Metropolitan Opera,2011-02-04 00:00:00,['Anthony Tommasini'],https://www.nytimes.com/2011/02/04/arts/music/04nixon.html,"['nixon', 'adams', 'mr', 'metropolitan', 'gelb', 'opera', 'place', 'peter', 'china', 'met', 'ovation', 'team']","During a panel discussion about “Nixon in China” on Tuesday at the Metropolitan Opera, Peter Gelb turned to the team of onetime artistic rebels who created this work for its Houston Grand Opera premiere in 1987 and suggested that back then, surely, no one involved had had any ambitions for the Met.
Other than “for its dismantlement,” Mr. Gelb added.
When Mr. Adams, who conducted the performance, first appeared in the pit, he received a cheering ovation from a full house.
This is the second John Adams opera to reach the Met.
Under Mr. Gelb the house now actively courts contemporary works and modern productions.",255,
Location Data Company Factual Merges With Foursquare,,['April'],https://www.adweek.com/digital/foursquare-acquires-location-data-company-factual-the-second-merger-in-less-than-a-year/,"['placed', 'foursquares', 'companies', 'location', 'million', 'ceo', 'company', 'tech', 'merges', 'data', 'foursquare', 'factual']","Foursquare has merged with information-sharing startup Factual to position itself as a leader in the location discovery tech market.
The fusion of the tech companies, which were both created in 2008 and launched in 2009, is slated to generate more than $150 million in revenue and will amplify Foursquare’s presence in 20 global markets across brands, advertisers, publishers and agencies.
With the tech from Placed and now Factual, Foursquare hopes to “establish the standard in location for the next decade, allowing our clients to accelerate the adoption of location technology as a must have in their day to day business operations,” Elbaz said.
When combined, Factual and Foursquare’s location data is integrated or accessible within platforms representing more than 80% of all programmatic ad spend, according to Elbaz’s blog post.
Foursquare’s partners and customers will now be offered a robust product portfolio that provides highly scalable audiences, offline attribution, point-of-interest data and developer tools that enable companies to analyze insights and optimize their marketing decisions.",370,
American architects mobilise to make coronavirus face shields for hospital workers,2020-03-29 00:00:00,['Marcus Fairs'],https://www.dezeen.com/2020/03/29/american-architects-coronavirus-face-shields-hospital-workers/?utm_medium=email&utm_campaign=Dezeen%20Weekly%20668&utm_content=Dezeen%20Weekly%20668+CID_835d62ddc0f55d4bd73fcd5aff576508&utm_source=Dezeen%20Mail&utm_term=Read%20more,"['architects', 'face', 'york', 'sabin', 'printed', 'mobilise', 'american', 'cornell', 'visors', 'coronavirus', 'workers', 'weill', 'need', 'hospital', 'shields']","Architects across America including BIG, KPF and Handel Architects have teamed up as part of an open-source project to manufacture face shields to protect hospital workers treating coronavirus patients.
Face shields help protect the wearer's face from body fluids and can be worn in conjunction with masks.
Other architects printing the shields include Handel Architects, Bjarke Ingels Group (BIG), Grimshaw, Terreform One, Kohn Pedersen Fox (KPF), Weiss Manfredi and Brooks + Scarpa.
""Weill Cornell Medicine estimated a need for 20,000-50,000 protective face shields per day in NYC,"" Sabin added.
The transparent plastic sheet that forms the shield, and which needs to be replaced or sanitised after each shift, is in greater need, Sabin said.",890,
A Message to Our Users,2020-04-01 00:00:00,"['Eric S. Yuan', 'Gary Chesnutis']",https://blog.zoom.us/wordpress/2020/04/01/a-message-to-our-users/?utm_campaign=2020-04-07&utm_medium=email&utm_source=courtside-20200407,"['world', 'platform', 'questions', 'better', 'privacy', 'security', 'help', 'message', 'data', 'zoom', 'users']","For the past several weeks, supporting this influx of users has been a tremendous undertaking and our sole focus.
These are the questions that will make Zoom better, both as a company and for all its users.
We have proactively sent out many of these resources to help familiarize users with Zoom.
We’re listening to our community of users to help us evolve our approach.
On March 29th, we updated our privacy policy to be more clear and transparent around what data we collect and how it is used – explicitly clarifying that we do not sell our users’ data, we have never sold user data in the past, and have no intention of selling users’ data going forward.",1362,
What Comes After the Turing Test?,,"['Gary Marcus', 'Gary Marcu']",https://www.newyorker.com/tech/annals-of-technology/what-comes-after-the-turing-test,"['eliza', 'goostman', 'eugene', 'comes', 'turing', 'test', 'understanding', 'intelligence', 'artificial', 'program', 'machine']","Over the weekend, the news broke that a “supercomputer” program called “Eugene Goostman”—an impersonation of a wisecracking, thirteen-year-old Ukranian boy—had become the first machine to pass the Turing Test.
The considerable hype around the announcement—nearly every tech blog and newspaper reported on the story—ignored a more fundamental question: What, exactly, is Eugene Goostman, and what does “his” triumph over the Turing Test really mean for the future of A.I.?
In terms of practical significance for artificial intelligence, though, passing the Turing Test means little.
If a person asks a machine “How tall are you?” and the machine wants to win the Turing test, it has no choice but to confabulate.
As I have learned from two decades of work as a cognitive scientist, the real value of the Turing Test comes from the sense of competition it sparks amongst programmers and engineers.",1085,
Victory Journal,,[],https://victoryjournal.com/stories/higher-ground/,"['basecamp', 'journal', 'life', 'ballard', 'snow', 'k2', 'tom', 'victory', 'hargreaves', 'climbing', 'mountain', 'climbers']","To Tom and Kate, my dear children, I am on the highest point in the world and I love you dearly.
Climbing K2 is very important to me but I can’t keep waiting and waiting, she writes on August 5th.
At basecamp, Ballard drinks his green tea and eats energy bars and chocolate and they all watch adventure films together.
K2 basecamp.
None of the five climbers with her at the time could give an account because they all died as well.",3160,
How to Have a Successful Virtual Happy Hour,2020-03-20 00:00:00,['Anna Goldfarb'],https://www.nytimes.com/2020/03/20/well/virus-virtual-happy-hour.html,"['happy', 'drink', 'successful', 'virtual', 'hours', 'hour', 'shot', 'recommends', 'person', 'let', 'zoom']","To get into the happy hour spirit at home, she recommends creating your own version of this classic happy hour staple.
Ms. Lynch shared a cocktail recipe for a drink called the Smoky Irishman before her virtual happy hour so people could get supplies and drink along if they wanted to.
Ms. Lawlor chose Zoom to host her virtual happy hour.
Be a good listenerMr. Summers encourages everyone who attends a virtual happy hour to be prepared to listen.
[Read more: How to Be a Better Listener]Keep the conversation lightAs chief experience officer of the Westfield, N.J., dinner club Fat, Drunk and Fancy, Kim DiGiovanni tried to introduce as much levity as possible while hosting her virtual happy hour.",432,
The 'No Code' Delusion,2020-01-13 00:00:00,['Alex Hudson'],https://www.alexhudson.com/2020/01/13/the-no-code-delusion/?mc_cid=55883457ce&mc_eid=e7c75333ad,"['need', 'systems', 'code', 'tools', 'think', 'business', 'delusion', 'logic', 'software', 'development', 'extremely']","I empathise with people doing this, and I think some of the “no code” tools are great.
The downside of trying to make this jump is that suddenly you’re becoming, at least in part, a software development company.
Specifically, the idea of writing business logic in text form according to the syntax of a technical programming language is anathema.
The various “no code” tools are extremely valuable, but I think must be deployed somewhat sparingly.
They are not a software development silver bullet, and as likely to make situations worse rather than better.",2236,
