title,publish_date,authors,url,keywords,summary,word_count,category
,,[],https://frankchimero.com/writing/,[],,0,
7 Reasons to Use Parchment Paper,2017-08-17 10:00:00,"['Sommer Collier', 'Sommer Collier Of']",https://thepioneerwoman.com/food-and-friends/7-reasons-to-use-parchment-paper/,"['pans', 'pan', 'reasons', 'foil', 'wax', 'post', 'baking', 'parchment', 'sheets', 'edges', 'paper']","Can you substitute foil or wax paper for parchment paper?
I’m always surprised to hear that so many bakers haven’t discovered the shining attributes of parchment paper.
Using parchment paper creates a thin airy layer between the baking sheet and the paper that helps regulate the temperature, and neutralize hot spots.
Parchment paper gives cookie dough something to hold on to, for fuller cookies that do not to spread too much.
Can you substitute foil or wax paper for parchment paper?",683,
"Journalism, Media, and Technology Trends and Predictions 2020",2020-01-09 11:07:14+00:00,['About The Author'],http://www.digitalnewsreport.org/publications/2020/journalism-media-and-technology-trends-and-predictions-2020/,"['2020', 'diversity', 'technology', 'politicians', 'important', 'trends', 'publishers', 'help', 'content', 'audio', 'platforms', 'media', 'predictions', 'journalism']","Local news provision is a key concern, alongside fears about declining trust and attacks on journalism by politicians.
At the same time, social and political disruptions have affected trust in journalism and led to attacks on independent news media in many countries.
The main purpose is to provide useful insights for the year ahead and to identify the most important media trends.
This report is supplemented with the following essays:These same media executives, however, are less confident about journalism in general (46%) and public-interest journalism in particular.
Politicians are increasingly trying to bypass the media and convey messages directly via social media.",6321,
AI trends: what to expect in 2020,2020-02-06 00:00:00,[],https://tryolabs.com/blog/2020/02/06/ai-trends-what-to-expect-in-2020/?utm_campaign=Data_Elixir&utm_source=Data_Elixir_271,"['results', 'recognition', 'deep', 'learning', 'trends', 'expect', 'facial', 'example', 'models', 'data', 'ai', '2020']","According to Forbes, 75 countries are currently using AI technology for surveillance purposes via smart city platforms, facial recognition systems, and smart policing.
Let’s briefly review the best in AI of 2019, as well as some of the most important trends for 2020.
2019 AI outcomesLast year was fruitful for AI and deep learning, especially in the Natural Language Processing (NLP) and Computer Vision (CV) fields.
Let’s look at the impact this will have on AI trends in 2020.
Their approach consists of a learning algorithm that automatically generates training data, learning environments, and curricula to help AI agents rapidly learn.",2409,
Learn to Let Go: How Success Killed Duke Nukem,,"['Clive Thompson', 'Clive Thompso']",https://www.wired.com/2009/12/fail-duke-nukem/,"['work', '3d', 'success', 'games', 'broussard', 'game', 'duke', 'forever', 'killed', 'miller', 'learn', 'nukem', 'let', 'realms']","It's the insignia of Duke Nukem 3D, a computer game that revolutionized shoot-'em-up virtual violence in 1996.
Featuring a swaggering, steroidal, wisecracking hero, Duke Nukem 3D became one of the top-selling videogames ever, making its creators very wealthy and leaving fans absolutely delirious for a sequel.
The team quickly began work on that sequel, Duke Nukem Forever, and it became one of the most hotly anticipated games of all time.
But the Duke Nukem Forever team worked for 12 years straight.
His name is George Broussard, co-owner of 3D Realms and the man who headed the Duke Nukem Forever project for its entire 12-year run.",728,
Hudson Valley's Best Restaurants and Hotels,2019-12-26 12:00:00,"['Jeff Gordinier', ""Jeff Gordinier Is Esquire'S Food"", 'Drinks Editor.']",https://www.esquire.com/food-drink/restaurants/a29001904/best-hudson-valley-upstate-new-york-restaurants-hotels/,"['hudson', 'schram', 'chef', 'york', 'valleys', 'restaurants', 'best', 'pelaccio', 'valley', 'love', 'menu', 'local', 'hotels', 'catskills']","Years ago, when he was a teenager in the Hudson Valley, Kristopher Schram put in time in the kitchen of a local pizzeria.
Now 36, Schram has boomeranged back to the Hudson Valley.
“This is not the Hudson Valley I remember.""
This is not the Hudson Valley I remember.""
This territory is expansive.”That expansiveness is one of the reasons you don’t hear too much grumbling about rampant hipsterization throughout the Hudson Valley and the Catskills.",2460,
Cold fusion remains elusive—but these scientists may revive the quest,2019-05-29 06:00:05-04:00,"['Photograph Marilyn Chung', 'Lawrence Berkeley National Laboratory']",https://www.nationalgeographic.com/science/2019/05/cold-fusion-remains-elusive-these-scientists-may-revive-quest/,"['quest', 'science', 'elusivebut', 'cold', 'remains', 'fusion', 'energy', 'revive', 'researchers', 'scientists', 'trevithick', 'team', 'work', 'experiment', 'research']","In a review paper published in Nature on Monday, U.S. and Canadian researchers funded by Google publicly unveiled their efforts to reassess cold fusion.
This would be a lot of people’s dream.”See the original 'cold fusion' press conference On March 23, 1989, University of Utah chemists Martin Fleischmann and Stanley Pons announced their ""cold fusion"" device to the world—sparking a scientific firestorm.
My impression is that most physicists and chemists did the same, regarding cold fusion as an 'interesting' episode.”Ever since, cold fusion largely served as a parable on the perils of irreproducibility.
Trevithick stresses that cold fusion represents just one sliver of Google's energy research, which includes working with the traditional fusion company TAE Technologies.
“I'm not addressing in particular whether [cold fusion] is one such candidate, but I generally am for trying out different things,” he says.",2024,
Spaces of Banana Control,,[],https://www.ediblegeography.com/spaces-of-banana-control/?mc_cid=280d7d018b&mc_eid=e7c75333ad,"['fruit', 'distributors', 'york', 'ripening', 'spaces', 'rooms', 'rosenblatt', 'room', 'control', 'banana', 'bananas', 'refrigerated']","A behind-the-scenes tour at the Banana Distributors of New York contains several examples of the banana supply chain’s evolving architecture of atmospheric control.
IMAGE: A clipboard hung on or near the door of each banana ripening room keeps track of the ambient temperature and ethylene gas injection.
“With bananas,” explains Rosenblatt, “it’s all about ventilation.”IMAGE: Paul Rosenblatt in front of the world’s first two-tier banana ripening rooms.
The next rooms that Rosenblatt showed us are, he mentions almost as an aside, the first two-tier banana ripening rooms ever built.
With minor improvements in fan engineering, and the optional addition of a third tier, brand-new banana ripening rooms still look identical to today.",1866,
"30 Python Best Practices, Tips, And Tricks",2020-05-03 07:17:29.856000+00:00,['Erik Van Baaren'],https://towardsdatascience.com/30-python-best-practices-tips-and-tricks-caefb9f8c5f5,"['tips', 'python', 'practices', 'sequence', 'replace', 'expression', 'basic', 'best', 'ugly', 'values', 'used', 'tricks', 'comprehension', '30', 'list', 'syntax']","List ComprehensionsA list comprehension can replace ugly for loops used to fill a list.
The basic syntax for a list comprehension is:[ expression for item in list if conditional ]A very basic example to fill a list with a sequence of numbers:And because you can use an expression, you can also do some math:Or even call an external function:And finally, you can use the ‘if’ to filter the list.
In this case, we only keep the values that are dividable by 2:",87,
Nike Kaepernick ads will be among the most memorable from the 2010s,2019-12-20 00:00:00,['Megan Graham'],https://www.cnbc.com/2019/12/20/kaepernick-like-a-girl-and-other-memorable-ads-from-the-2010s.html,"['small', 'business', 'barbie', 'marketing', 'campaign', 'brand', 'burger', 'nike', 'company', 'kaepernick', 'memorable', 'ads', 'consumers', '2010s', 'president']","If there's a thread connecting the most memorable campaigns of the last 10 years, it's that big risks can pay off.
'Small Business Saturday,' American ExpressPresident Barack Obama buys ice cream for his daughters Malia and Sasha at Pleasant Pops during Small Business Saturday on November 28, 2015, in Washington, DC.
Getty ImagesCredit card company American Express started the ""Small Business Saturday"" campaign in the dregs of a recession in November 2010.
American Express estimates Small Business Saturday spending has reached $103 billion since the day it began.
Goodson said Small Business Saturday ""took a stand for Main Street and small business, folks who never have any support and who find themselves in the direct line of fire from the Amazons of the world,"" he said.",1544,
"Stepping Into the Uncanny, Unsettling World of Shen Yun",,"['Jia Tolentino', 'Jia Tolentin']",https://www.newyorker.com/culture/culture-desk/stepping-into-the-uncanny-unsettling-world-of-shen-yun?verso=true,"['uncanny', 'world', 'organization', 'communist', 'falun', 'chinese', 'unsettling', 'gong', 'dafa', 'began', 'stepping', 'asked', 'shen', 'dancers']","The hosts started talking about a spiritual discipline called Falun Dafa, and then introduced a dance in which a beautiful young follower of Falun Dafa was kidnapped and imprisoned by Communists, who harvested her organs.
Falun Gong was founded by a man named Li Hongzhi, who registered the group with the Chinese government in 1992.
(In 1989, after the Tiananmen Square Protests, the Chinese Communist Party established a registry of social organizations, in order to head off political upheaval.)
He soon attracted “tens of millions of adherents,” the political-science professor Maria Hsia Chang writes in “Falun Gong: The End of Days.” Falun Gong started holding enormous gatherings; by the mid-nineties, there were more than two thousand Falun Gong practice stations in Beijing alone.
Luo set up a Web site called The Untold Story of Falun Gong in 2007, and Falun Gong responded by complaining to the domain provider.",2309,
,,,anna.nicanorova/Downloads/SSRN-id3432728.pdf,,,,
Page Cannot be Found,,[],https://papers.ssrn.com/sol3/papers.cfm?abstract_id=3432728&download=yes,"['page', 'informedyou', 'administrator', 'oopswere', 'sorry', 'site', 'information', 'able', 'looking', 'need']","We're sorry, but the page you are looking for cannot be found.
The site administrator has been informed.
You may be able to find the information you need at:",31,
Introducing The Overflow and Cassidy Williams,2019-10-01 00:00:00,"['Cassidy Williams', 'Ryan Donovan', 'Medi Madelen Gwosdz']",https://stackoverflow.blog/2019/10/01/introducing-overflow-newsletter-cassidy-williams/?utm_source=Iterable&utm_medium=email&utm_campaign=the_overflow_newsletter&utm_content=01-07-20,"['send', 'developers', 'overflow', 'introducing', 'community', 'cassidy', 'email', 'stack', 'preferences', 'software', 'work', 'newsletter', 'williams']","Keycaps are very fun and Cassidy probably has too manyToday we’re launching The Overflow, a newsletter from Stack Overflow that brings together great questions from our community, news and articles from our blog, and awesome links from around the web.
We’ll send a new issue out once every two weeks.Helping us put The Overflow together is software engineer Cassidy Williams !
You might recognize her from her funny dev videos she shares or from one of the many podcasts and conferences at which she’s spoken.If you want to subscribe to The Overflow, log into your Stack Overflow account and head over to your email preferences .
That led to my career changes, and that also led to joining forces with Stack Overflow on a new, exciting project.Today, I’m helping Stack Overflow launch something very fun: a bi-weekly newsletter that we’re calling The Overflow.
Also your newsletter content.If you want to sign up for the The Overflow, you’ll need a Stack Overflow account.",1144,
,,[],https://indd.adobe.com/view/ea8c6857-8ce6-4301-9027-587d3ca71a45?__hstc=62055283.440554de32bf541465c2c4474eab9d8b.1575644025446.1575644025446.1576607458682.2&__hssc=62055283.1.1576607458682&submissionGuid=def593c1-c135-4012-a590-990dbe8717af,"['page', 'quick', 'adobe', 'filling', 'feel', 'terms', 'report', 'form', 'violates', 'content']",,26,
Omnicom’s Jonathan Nelson On The Invention Of Ads Data Hub And Why Data For Data’s Sake Is A Waste,2020-01-03 12:30:01-05:00,[],https://adexchanger.com/agencies/omnicoms-jonathan-nelson-on-the-invention-of-ads-data-hub-and-why-data-for-datas-sake-is-a-waste/,"['need', 'gardens', 'invention', 'omnicoms', 'hub', 'datas', 'walled', 'sake', 'waste', 'jonathan', 'going', 'regulation', 'nelson', 'dont', 'good', 'ads', 'data', 'omnicom']","“You have to look at broad groups of data to understand consumption,” said Jonathan Nelson, CEO of Omnicom Digital.
“The industry is having the right conversation, but it has stopped at ‘data is good,’” Nelson said.
“It allows us to start to orchestrate across walled gardens and work with them on their own terms,” Nelson said.
We don’t need to own it to get the insights.
One of the results of privacy law has been the rise of walled gardens.",1173,
The Sociology of Hackathons,,['Originally Published'],https://hackernoon.com/the-sociology-of-hackathons-a4f66c67a2b8,"['hacker', 'uncommon', 'community', 'sociology', 'hackathons', 'hackers', 'culture', 'hacks', 'hackathon', 'project', 'build']","The first hackathons started around 1999 with companies such as OpenBSD in Alberta and Sun Microsystems holding in-company hackathons.
Furthermore, I will be focusing on student hackathons, as those are the most prevalent competitive community hackathons and are the easiest to get information and resources about online.
This autotelic aspect of hackathons was ever present in the conversations I had with participants at Uncommon Hacks.
These Facebook groups are ways of members of the hacker community to communicate besides meeting at hackathons.
Hacker culture and hackathon culture seems to have the same intentions as when it started: to create.",4204,
What Qualifies as Middle-Income in Each State,2019-04-12 00:00:00,['Nathan Yau'],https://flowingdata.com/2019/04/12/middle-income-ranges-in-each-state/,"['twothirds', 'shifts', 'median', 'state', 'middle', 'household', 'upper', 'qualifies', 'middleincome', 'households', 'lower']","What qualifies as lower, middle, and upper income?
There are various definitions, but the Pew Research Center defined middle-income as two-thirds to double the median.
Upper is then everything that is greater than double the median, and lower is everything that is less than two-thirds the median.
Here’s what you get when you apply this definition to each state and adjust for household size.
Household Middle-Income Bars represent a range for each state, sorted by median and adjusted for household size.",159,
robert caro — Tool feed — The Prepared,,['Robert A. Caro'],https://theprepared.org/tool-feed/tag/robert+caro?mc_cid=30b96dc09b&mc_eid=e7c75333ad,"['moses', 'tool', 'prepared', 'power', 'held', 'york', 'urbanity', 'writing', 'feed', 'vision', 'caro', 'ways', 'wont', 'broker', 'robert']","If you want to learn about how to get things done, The Power Broker is a must read.
Robert Moses was a tyrant; he was a racist; he was incredibly effective at accomplishing what he set out to do.
His vision of urbanity, transit, and recreation were propagated across the United States, with the automobile at a singular focus - and Moses never held a driver’s license.
Caro’s writing in The Power Broker is powerful, and the saga that he tells is almost beyond belief.
It’s a significant book, to say the least - and one that you won’t regret having read.",131,
9 Outfits For Every Art World Occasion,2020-01-08 07:38:58+00:00,[],https://theartgorgeous.com/9-outfits-every-art-world-occasion/?utm_source=Subscribers+from+Website+Formular&utm_campaign=3251fdc979-EMAIL_CAMPAIGN_2019_06_27_09_21_COPY_01&utm_medium=email&utm_term=0_dfb663f5de-3251fdc979-88354685,"['world', 'think', 'dress', 'art', 'dont', 'casual', 'occasion', 'good', 'youre', 'outfits', 'private', 'hard']","The art world is a very social space full of parties, galas and private views.
But, fear not my good friends, we’ve sorted you out with what to wear for every art world occasion.
For The Art World InterviewThe art world is known for being less stuffy than most professions, but still, when you’re turning up for an interview at your dream gallery or auction house, it’s best to dress to impress.
The art world tends to travel en masse to biennials and art fairs, so you shouldn’t be shocked if you run into your frenemy at duty free.
For The Fancy Art GalaThe art gala is the one time of year when you can really go all out and nobody will talk bad about you.",602,
Patagonia Is Refusing To Sell Its Iconic Power Vests To Some Financial Firms,,"['Katie Notopoulos', 'Nicole Nguyen', 'Buzzfeed News Reporter']",https://www.buzzfeednews.com/article/katienotopoulos/patagonia-power-vest-policy-change?mc_cid=280d7d018b&mc_eid=e7c75333ad,"['companies', 'power', 'vests', 'brand', 'orders', 'patagonia', 'firms', 'iconic', 'corporate', 'finance', 'vest', 'tech', 'sales', 'sell', 'refusing', 'financial']","The vest purveyor of choice for tech and finance bros now is prioritizing bulk orders of corporate swag to mission-driven companies.
Farewell #patagonia vests.
Binna Kim's order for branded vests was rejected by the third party supplier who handled large corporate orders.
Here is the company’s statement: “Our corporate sales program manages Patagonia’s sales to other companies, non-profits and other organizations.
This shift does not affect current customers in our corporate sales program.”The outdoor sports brand has been noticeably political.",729,
Thoughts On Svelte.,2019-12-11 04:38:28+00:00,"['John Telaak', 'Jesse Zunti']",https://ilikekillnerds.com/2019/12/thoughts-on-svelte/,"['code', 'aurelia', 'thoughts', 'vue', 'going', 'applications', 'dom', 'react', 'syntax', 'svelte', 'library']","If you are not familiar, Svelte is a Javascript library which leverages a compiler to turn your Svelte code into plain old Javascript and HTML.
You write your applications inside of .svelte files and they get compiled to something that has no runtime.
This puts Svelte into a similar league alongside Elm, Imba and a few others, not directly in line with React or Vue.
The generated code I have seen from Svelte applications is surprisingly readable as well.
I can definitely see the hype around Svelte is more than warranted and in the end, competition is healthy.",1714,
Hype House and the Los Angeles TikTok Mansion Gold Rush,2020-01-03 00:00:00,['Taylor Lorenz'],https://www.nytimes.com/2020/01/03/style/hype-house-los-angeles-tik-tok.html?auth=login-email&login=email,"['need', 'rush', 'tiktok', 'houses', 'chase', 'internet', 'thomas', 'weird', 'gold', 'mansion', 'angeles', 'party', 'team', 'los', 'hype', 'house']","Alex, Thomas, Daisy Keech, 20, and Kouvr Annon, 19, live at the house full time.
Though Chase helped put money down for the house, Thomas manages schedules, handles the house issues and resolves the inevitable conflicts.
Unlike Team 10 and other groups, Hype House doesn’t take a cut of anyone’s revenue.
Creators can have friends over, but it is not a party house.
The weird people get the furthest on the internet,” Chase said.",312,
Opinion | No More Phones and Other Tech Predictions for the Next Decade,2019-12-31 00:00:00,['Kara Swisher'],https://www.nytimes.com/2019/12/31/opinion/2019-in-tech.html?auth=login-email&login=email,"['think', 'digital', 'world', 'success', 'big', 'way', 'phones', 'decade', 'tech', 'lot', 'predictions', 'opinion', 'social', 'climate']","More investment in tech that addresses climate change.
Which is why it is critically important that tech turn its focus toward creating products that will save us.
The amount of investment in green technology remains stubbornly low compared with other tech sectors.
Many jobs will, in fact, be replaced by tech, especially ones that are rote and also many that are high paying in medicine, law and more.
The smartest minds in tech should be thinking about reformulating and recalibrating the workplace and the structure of businesses.",636,
What Will Happen In The 2020s,2020-01-01 15:39:00+00:00,[],https://avc.com/2020/01/what-will-happen-in-the-2020s/,"['services', 'space', '2020s', 'world', 'slow', 'decentralized', 'consumer', 'happen', 'decade', 'countries', 'capital', 'regions']","One of my favorite quotes, attributed to Bill Gates, is that people overestimate what will happen in a year and underestimate what will happen in a decade.
We will see carbon taxed like the vice that it is in most countries around the world this decade, including in the US.
The fight for who should have access to this massive consumer surplus will define the politics of the 2020s.
5/ A decentralized internet will emerge, led initially by decentralized infrastructure services like storage, bandwidth, compute, etc.
The emergence of decentralized consumer applications will be slow to take hold and a killer decentralized consumer app will not emerge until the latter part of the decade.",891,
What's Going On With AVC?,2019-12-29 14:37:44+00:00,[],https://avc.com/2019/12/whats-going-on-with-avc/,"['rendering', 'avc', 'design', 'renders', 'going', 'wordpress', 'right', 'yesterdays', 'theme', 'whats', 'wright', 'safari']","As Jason Wright said in the comments to yesterday’s post:This blog is rendering like it’s 1998 in Safari and Chrome at the moment.
The theme that renders AVC in WordPress got messed up somehow and we are having a hard time getting it back to normal.
I am planning on relaunching AVC with a entirely new theme and design in the New Year and so I’m not particularly motivated to address this issue right now.
I’m open to feedback on why I should or should not bother, but my feeling is we can live with this bare bones design for the next ten days.",109,
Salary and Occupation,2019-11-18 00:00:00,['Nathan Yau'],https://flowingdata.com/2019/11/18/salary-and-occupation/,"['groups', 'occupation', 'median', 'salaries', 'distributions', 'represents', 'salary', 'theres', 'data', 'statistics']","At one end of the spectrum, based on 2018 data from the Bureau of Labor Statistics, physicians have a median salary of $200,890 in the United States.
In contrast, waiters and waitresses have a median salary of $21,780.
Occupations and Salary Vertical position represents median annual salary.
While the above gives you an overall picture, it’s difficult to see separate distributions between occupation groups.
So here’s the same view with occupation groups separated.",319,
Magellan AI — podcast advertising analytics,,[],https://www.magellan.ai/,"['tools', 'shows', 'verifying', 'magellan', 'analytics', 'podcast', 'hours', 'submission', 'spent', 'advertising', 'ai', 'showsdig', 'vet', 'streamline']","Streamline your podcast media planning with tools to find and vet showsDig deep into your competitors’ activity with advertising data from over 30,000 shows and 19,000 brandsSave the hours spent verifying ads with airchecks delivered to your inbox within 24 hours of submission",47,
The 66 Countries Where Annual Average Electricity Consumption Per Person Is Less Than 1 Bitcoin Transaction,2019-02-27 10:04:03+00:00,[],https://powercompare.co.uk/bitcoin-per-capita/?mc_cid=30b96dc09b&mc_eid=e7c75333ad,"['bitcoin', '66', 'consumption', 'islands', 'electricity', 'kwh', '819', 'annual', 'average', 'mining', 'countries', 'transaction', 'person']","The map above is a world map only showing countries who’s annual average electricity consumption per person is less than that used to perform 1 Bitcoin Transaction (819 KWh according to the Bitcoin Energy Consumption Index).
A few quick facts:66 countries/territories consume less electricity per person per year than that used for a single Bitcoin transaction (819 KWh at the time of writing).
countries/territories consume less electricity per person per year than that used for a single Bitcoin transaction (819 KWh at the time of writing).
Last year we wrote about how Bitcoin Mining Was Now Consuming More Electricity Than 159 Countries (update here) and The Estimated Electricity Cost Of Mining One Bitcoin By Country.
Here’s a map showing Where Annual Average Electricity Consumption Per Person Is Less Than Mining One Bitcoin (Hint it’s every country in the world).",1297,
Some Notable Women in AECO (& beyond) Design Computation,,[],https://docs.google.com/spreadsheets/d/1DayNF6ejFCU45LAUo10-eFTDQ2MCwXWer3JSVWIFWCE/edit?mc_cid=30b96dc09b&mc_eid=e7c75333ad#gid=0,"['computational', 'fabrication', 'digital', 'usa', 'yes', 'design', 'aeco', 'notable', 'bim', 'computation', 'data', 'vr', 'robotics', 'women']","Still loading…A B C D E F G H I J 1 This document is no longer publicly editable and is now being moderated.
Quotes are not sourced from all markets and may be delayed up to 20 minutes.
Information is provided 'as is' and solely for informational purposes, not for trading purposes or advice.Disclaimer Sheet1A browser error has occurred.
Please press Ctrl-F5 to refresh the page and try again.
Please hold the Shift key and click the Refresh button to try again.",1375,
